{
  "$schema": "https://json-schema.org/draft/2020-12/schema",
  "$id": "https://heimgewebe.local/contracts/grabowski/access-policy.v2.schema.json",
  "title": "Grabowski Access Policy v2",
  "type": "object",
  "additionalProperties": false,
  "required": [
    "version",
    "mode",
    "read_roots",
    "write_roots",
    "write_excluded_roots",
    "secret_roots",
    "browser_profile_roots",
    "secret_export_roots",
    "max_read_bytes",
    "max_write_bytes",
    "max_list_entries",
    "max_secret_use_output_bytes",
    "max_secret_use_seconds",
    "forbid_symlinks",
    "forbidden_components",
    "forbidden_file_patterns",
    "forbidden_capabilities"
  ],
  "properties": {
    "version": {
      "const": 2
    },
    "mode": {
      "type": "string",
      "minLength": 1
    },
    "active_profile": {
      "type": "string",
      "minLength": 1
    },
    "read_roots": {
      "type": "array",
      "items": {
        "type": "string",
        "minLength": 1
      },
      "uniqueItems": true
    },
    "write_roots": {
      "type": "array",
      "items": {
        "type": "string",
        "minLength": 1
      },
      "uniqueItems": true
    },
    "write_excluded_roots": {
      "type": "array",
      "items": {
        "type": "string",
        "minLength": 1
      },
      "uniqueItems": true
    },
    "secret_roots": {
      "type": "array",
      "items": {
        "type": "string",
        "minLength": 1
      },
      "uniqueItems": true
    },
    "browser_profile_roots": {
      "type": "array",
      "items": {
        "type": "string",
        "minLength": 1
      },
      "uniqueItems": true
    },
    "secret_export_roots": {
      "type": "array",
      "items": {
        "type": "string",
        "minLength": 1
      },
      "uniqueItems": true
    },
    "max_read_bytes": {
      "type": "integer",
      "minimum": 1
    },
    "max_write_bytes": {
      "type": "integer",
      "minimum": 1
    },
    "max_list_entries": {
      "type": "integer",
      "minimum": 1
    },
    "max_secret_use_output_bytes": {
      "type": "integer",
      "minimum": 1
    },
    "max_secret_use_seconds": {
      "type": "integer",
      "minimum": 1
    },
    "forbid_symlinks": {
      "type": "boolean"
    },
    "forbidden_components": {
      "type": "array",
      "items": {
        "type": "string"
      },
      "uniqueItems": true
    },
    "forbidden_file_patterns": {
      "type": "array",
      "items": {
        "type": "string"
      },
      "uniqueItems": true
    },
    "forbidden_capabilities": {
      "type": "array",
      "items": {
        "type": "string",
        "enum": [
          "file_read",
          "file_write",
          "friction_record",
          "audit_verify",
          "audit_read",
          "rollback_text",
          "bundle_registry",
          "secret_inspect",
          "secret_reveal",
          "secret_use",
          "secret_export",
          "browser_profile_read",
          "terminal_execute",
          "bureau_mutation",
          "maulwurf_recovery_control",
          "durable_job",
          "resource_lease",
          "artifact_transfer",
          "browser_worker",
          "gui_worker",
          "git_cli",
          "github_cli",
          "user_service_logs_read",
          "user_service_control",
          "tmux_interaction",
          "process_inspect",
          "process_signal",
          "port_inspect",
          "privileged_reference",
          "power_execute",
          "file_delete",
          "file_destroy",
          "file_move",
          "chmod",
          "chown",
          "secret_read"
        ]
      },
      "uniqueItems": true
    },
    "capability_definitions": {
      "type": "object",
      "additionalProperties": {
        "type": "string",
        "minLength": 1
      }
    },
    "profiles": {
      "type": "object",
      "minProperties": 1,
      "additionalProperties": {
        "type": "object",
        "additionalProperties": false,
        "required": [
          "description",
          "read_roots",
          "write_roots",
          "write_excluded_roots",
          "secret_roots",
          "browser_profile_roots",
          "secret_export_roots",
          "capabilities",
          "allowed_grips",
          "forbidden_hosts",
          "max_risk_level"
        ],
        "properties": {
          "description": {
            "type": "string",
            "minLength": 1
          },
          "read_roots": {
            "type": "array",
            "items": {
              "type": "string",
              "minLength": 1
            },
            "uniqueItems": true
          },
          "write_roots": {
            "type": "array",
            "items": {
              "type": "string",
              "minLength": 1
            },
            "uniqueItems": true
          },
          "write_excluded_roots": {
            "type": "array",
            "items": {
              "type": "string",
              "minLength": 1
            },
            "uniqueItems": true
          },
          "secret_roots": {
            "type": "array",
            "items": {
              "type": "string",
              "minLength": 1
            },
            "uniqueItems": true
          },
          "browser_profile_roots": {
            "type": "array",
            "items": {
              "type": "string",
              "minLength": 1
            },
            "uniqueItems": true
          },
          "secret_export_roots": {
            "type": "array",
            "items": {
              "type": "string",
              "minLength": 1
            },
            "uniqueItems": true
          },
          "max_read_bytes": {
            "type": "integer",
            "minimum": 1
          },
          "max_write_bytes": {
            "type": "integer",
            "minimum": 1
          },
          "max_list_entries": {
            "type": "integer",
            "minimum": 1
          },
          "max_secret_use_output_bytes": {
            "type": "integer",
            "minimum": 1
          },
          "max_secret_use_seconds": {
            "type": "integer",
            "minimum": 1
          },
          "capabilities": {
            "type": "array",
            "items": {
              "type": "string",
              "enum": [
                "file_read",
                "file_write",
                "friction_record",
                "audit_verify",
                "audit_read",
                "rollback_text",
                "bundle_registry",
                "secret_inspect",
                "secret_reveal",
                "secret_use",
                "secret_export",
                "browser_profile_read",
                "terminal_execute",
                "bureau_mutation",
                "maulwurf_recovery_control",
                "durable_job",
                "resource_lease",
                "artifact_transfer",
                "browser_worker",
                "gui_worker",
                "git_cli",
                "github_cli",
                "user_service_logs_read",
                "user_service_control",
                "tmux_interaction",
                "process_inspect",
                "process_signal",
                "port_inspect",
                "privileged_reference",
                "power_execute",
                "file_delete",
                "file_destroy",
                "file_move",
                "chmod",
                "chown",
                "secret_read"
              ]
            },
            "uniqueItems": true
          },
          "trusted_owner": {
            "type": "boolean"
          },
          "allowed_grips": {
            "type": "array",
            "items": {
              "type": "string",
              "minLength": 1
            },
            "uniqueItems": true
          },
          "forbidden_hosts": {
            "type": "array",
            "items": {
              "type": "string",
              "minLength": 1
            },
            "uniqueItems": true
          },
          "max_risk_level": {
            "type": "string",
            "enum": [
              "low",
              "medium",
              "high"
            ]
          }
        }
      }
    },
    "trusted_owner": {
      "type": "boolean"
    },
    "allowed_grips": {
      "type": "array",
      "items": {
        "type": "string",
        "minLength": 1
      },
      "uniqueItems": true
    },
    "forbidden_hosts": {
      "type": "array",
      "items": {
        "type": "string",
        "minLength": 1
      },
      "uniqueItems": true
    },
    "max_risk_level": {
      "type": "string",
      "enum": [
        "low",
        "medium",
        "high"
      ]
    }
  }
}
