{
  "active_profile": "trusted-owner",
  "allowed_grips": [
    "*"
  ],
  "browser_profile_roots": [
    "${HOME}/.local/state/grabowski/browser-profiles"
  ],
  "capability_definitions": {
    "artifact_transfer": "Transfer regular files with hash-bound source and destination preconditions.",
    "audit_verify": "Verify the tamper-evident write audit chain.",
    "audit_read": "Read bounded safe fields from the verified audit chain without granting audit mutation authority.",
    "browser_profile_read": "Read bounded browser profile metadata and text under explicit browser profile roots; managed operator browser profiles are always opaque.",
    "browser_worker": "Start and control isolated agent-owned browser workers with loopback-only debugging and optional named managed persistent profiles.",
    "bundle_registry": "Read the curated Lens/repoLens latest-complete bundle registry.",
    "bureau_mutation": "Use only the typed Bureau candidate, proposal, review, publication and coordinated-pickup mutation surfaces without granting generic terminal execution.",
    "maulwurf_recovery_control": "Toggle only the local der-kleine-Maulwurf NORMAL/RECOVERY marker; grants no generic file or terminal authority.",
    "durable_job": "Start long-running transient user-systemd jobs with extended Trusted Owner budgets.",
    "file_delete": "Remove regular files or empty directories into quarantine for audit-backed restoration.",
    "file_destroy": "Irreversibly remove regular files or empty directories only through a separate explicit capability.",
    "file_read": "Read bounded, non-secret text and metadata inside configured roots.",
    "file_write": "Create and replace bounded text files with hash preconditions, audit and quarantine.",
    "git_cli": "Run guarded Git commands inside a repository.",
    "github_cli": "Run GitHub CLI with redacted output.",
    "gui_worker": "Start and control isolated Xvfb GUI workers without a remote display listener.",
    "port_inspect": "Inspect listening sockets.",
    "power_execute": "Run audited root commands through the canonical root-owned broker without a recovery gate or command allowlist.",
    "privileged_reference": "Create privileged references and use the installed trusted-owner root broker escape hatch.",
    "process_inspect": "Inspect current-user processes.",
    "process_signal": "Signal current-user processes with protected PID checks.",
    "resource_lease": "Acquire, renew, inspect and release typed collision-control resource leases.",
    "rollback_text": "Restore a quarantined preimage from an audited replace transaction.",
    "secret_export": "Atomically create a local 0600 copy inside configured secret export roots with a source hash precondition.",
    "secret_inspect": "Inspect metadata and bounded directory listings under explicit secret roots without returning file content.",
    "secret_reveal": "Break-glass reveal only with a current SHA-256, justification and explicit context-exposure acknowledgement; prefer secret_use.",
    "secret_use": "Run bounded argv-only commands with a secret supplied through an inherited file descriptor or restrictive temporary fallback.",
    "terminal_execute": "Run arbitrary host-visible commands, including shells and privilege frontends, with audit and redacted output.",
    "tmux_interaction": "Read or send literal input to existing tmux panes.",
    "user_service_control": "Inspect and control user-level systemd units.",
    "user_service_logs_read": "Read bounded recent current-user service journal lines; journal content may contain application secrets."
  },
  "forbid_symlinks": false,
  "forbidden_capabilities": [],
  "forbidden_components": [],
  "forbidden_file_patterns": [],
  "forbidden_hosts": [],
  "max_list_entries": 100000,
  "max_read_bytes": 33554432,
  "max_risk_level": "high",
  "max_secret_use_output_bytes": 33554432,
  "max_secret_use_seconds": 3600,
  "max_write_bytes": 33554432,
  "mode": "trusted-owner",
  "profiles": {
    "failover-mutate": {
      "allowed_grips": [
        "repo-orient",
        "worktree-orient",
        "situation",
        "scout",
        "pr-check-readiness",
        "post-merge-sync"
      ],
      "browser_profile_roots": [],
      "capabilities": [
        "file_read",
        "audit_verify",
        "audit_read",
        "bureau_mutation",
        "maulwurf_recovery_control",
        "resource_lease",
        "process_inspect",
        "port_inspect"
      ],
      "description": "Minimal mutation profile for controlled failover. It grants the typed recovery switch plus Bureau and resource-lease effects while excluding generic file, job, terminal, service, browser/GUI, secret, signal, power and destructive authority.",
      "forbidden_hosts": [],
      "max_list_entries": 500,
      "max_read_bytes": 2000000,
      "trusted_owner": false,
      "max_risk_level": "medium",
      "max_secret_use_output_bytes": 250000,
      "max_secret_use_seconds": 30,
      "max_write_bytes": 2000000,
      "read_roots": [
        "${HOME}/repos",
        "${HOME}/grabowski-workspace",
        "${HOME}/.local/state/grabowski",
        "${HOME}/.local/state/bureau"
      ],
      "secret_export_roots": [],
      "secret_roots": [],
      "write_excluded_roots": [
        "${HOME}/repos/merges"
      ],
      "write_roots": [
        "${HOME}/repos",
        "${HOME}/.local/state/grabowski",
        "${HOME}/.local/state/bureau"
      ]
    },
    "maintain": {
      "allowed_grips": [
        "repo-orient",
        "worktree-orient",
        "worktree-ensure",
        "situation",
        "scout",
        "pr-check-readiness",
        "post-merge-sync",
        "mechanic-loop",
        "branch-publish",
        "pr-create-or-update"
      ],
      "browser_profile_roots": [],
      "capabilities": [
        "file_read",
        "file_write",
        "audit_verify",
        "audit_read",
        "rollback_text",
        "bundle_registry",
        "durable_job",
        "git_cli",
        "github_cli",
        "user_service_logs_read",
        "user_service_control",
        "resource_lease",
        "artifact_transfer",
        "browser_worker",
        "gui_worker",
        "process_inspect",
        "port_inspect",
        "friction_record"
      ],
      "description": "Bounded maintenance profile for repository and operator-state changes with audit, receipts and medium-risk grips. It excludes terminal execution, secrets, tmux, process signals, privilege and irreversible destroy.",
      "forbidden_hosts": [],
      "max_list_entries": 500,
      "max_read_bytes": 2000000,
      "max_risk_level": "medium",
      "max_secret_use_output_bytes": 250000,
      "max_secret_use_seconds": 30,
      "max_write_bytes": 2000000,
      "read_roots": [
        "${HOME}/repos",
        "${HOME}/grabowski-workspace",
        "${HOME}/.local/state/grabowski"
      ],
      "secret_export_roots": [],
      "secret_roots": [],
      "write_excluded_roots": [
        "${HOME}/repos/merges"
      ],
      "write_roots": [
        "${HOME}/repos",
        "${HOME}/grabowski-workspace"
      ]
    },
    "observe": {
      "allowed_grips": [
        "repo-orient",
        "worktree-orient",
        "situation",
        "scout",
        "pr-check-readiness",
        "post-merge-sync"
      ],
      "browser_profile_roots": [],
      "capabilities": [
        "file_read",
        "audit_verify",
        "audit_read",
        "bundle_registry",
        "process_inspect",
        "port_inspect",
        "friction_record"
      ],
      "description": "Read/status profile. It intentionally omits coarse capabilities that currently unlock mutating tools.",
      "forbidden_hosts": [],
      "max_list_entries": 500,
      "max_read_bytes": 2000000,
      "max_risk_level": "low",
      "max_secret_use_output_bytes": 250000,
      "max_secret_use_seconds": 30,
      "max_write_bytes": 2000000,
      "read_roots": [
        "${HOME}/repos",
        "${HOME}/grabowski-workspace",
        "${HOME}/.local/state/grabowski"
      ],
      "secret_export_roots": [],
      "secret_roots": [],
      "write_excluded_roots": [
        "${HOME}/repos/merges"
      ],
      "write_roots": []
    },
    "trusted-owner": {
      "allowed_grips": [
        "*"
      ],
      "browser_profile_roots": [
        "${HOME}/.local/state/grabowski/browser-profiles"
      ],
      "capabilities": [
        "file_read",
        "file_write",
        "audit_verify",
        "audit_read",
        "rollback_text",
        "bundle_registry",
        "secret_inspect",
        "secret_reveal",
        "secret_use",
        "secret_export",
        "terminal_execute",
        "bureau_mutation",
        "maulwurf_recovery_control",
        "durable_job",
        "resource_lease",
        "artifact_transfer",
        "browser_worker",
        "gui_worker",
        "git_cli",
        "github_cli",
        "user_service_logs_read",
        "user_service_control",
        "tmux_interaction",
        "process_inspect",
        "process_signal",
        "port_inspect",
        "privileged_reference",
        "power_execute",
        "file_delete",
        "file_destroy",
        "file_move",
        "chmod",
        "chown"
      ],
      "description": "Trusted owner profile: unrestricted host-visible user execution, broad filesystem access, full capabilities, and compatibility with the root broker escape hatch.",
      "forbidden_hosts": [],
      "max_list_entries": 100000,
      "max_read_bytes": 33554432,
      "max_risk_level": "high",
      "max_secret_use_output_bytes": 33554432,
      "max_secret_use_seconds": 3600,
      "max_write_bytes": 33554432,
      "read_roots": [
        "/"
      ],
      "secret_export_roots": [
        "${HOME}"
      ],
      "secret_roots": [
        "${HOME}/.ssh",
        "${HOME}/.gnupg",
        "${HOME}/.aws",
        "${HOME}/.kube",
        "${HOME}/.password-store",